{
  "$schema": "https://json-schema.org/draft/2020-12/schema",
  "$id": "https://outlet.dev/schemas/registry-item.schema.json",
  "title": "Outlet registry item manifest",
  "description": "Explicit, per-item manifest (<item>.registry.json) describing a single installable registry item. The manifest is the source of truth consumed by the Outlet engine; it must never lie about the files it ships.",
  "type": "object",
  "additionalProperties": false,
  "required": ["name", "type", "concern", "targetFrameworks", "files"],
  "properties": {
    "$schema": {
      "type": "string",
      "description": "Optional JSON Schema reference for editor tooling."
    },
    "name": {
      "type": "string",
      "description": "Unique item id, lowercase kebab-case (a-z, 0-9, '-'). E.g. 'email-smtp'.",
      "pattern": "^[a-z0-9]+(-[a-z0-9]+)*$"
    },
    "type": {
      "type": "string",
      "description": "Item kind. A contract is a generic port + DTOs with zero external dependency; an adapter implements a contract against a provider library.",
      "enum": ["outlet:contract", "outlet:adapter"]
    },
    "concern": {
      "type": "string",
      "description": "Infrastructure concern this item belongs to, a single lowercase word. E.g. 'email'. One concern groups one contract plus its interchangeable adapters.",
      "pattern": "^[a-z]+$"
    },
    "description": {
      "type": "string",
      "description": "Human-readable one-liner shown in the catalogue."
    },
    "targetFrameworks": {
      "type": "array",
      "description": "Target frameworks the item is known to build against (floor compatibility). The CLI refuses to install into a project whose TFM is not covered here.",
      "minItems": 1,
      "items": {
        "type": "string",
        "pattern": "^net[0-9]+\\.[0-9]+$"
      }
    },
    "registryDependencies": {
      "type": "array",
      "description": "Other registry items this item depends on, by name (e.g. an adapter depends on 'email-abstractions'). Resolved recursively by the engine.",
      "items": {
        "type": "string",
        "pattern": "^[a-z0-9]+(-[a-z0-9]+)*$"
      }
    },
    "nugetDependencies": {
      "type": "array",
      "description": "Direct NuGet dependencies. Versions are FLOORS (minimum), never locks; transitive resolution is left to NuGet. A contract item MUST declare none.",
      "items": {
        "type": "object",
        "additionalProperties": false,
        "required": ["id", "version"],
        "properties": {
          "id": {
            "type": "string",
            "description": "NuGet package id, e.g. 'MailKit'."
          },
          "version": {
            "type": "string",
            "description": "Minimum acceptable version (floor), e.g. '4.8.0'."
          }
        }
      }
    },
    "files": {
      "type": "array",
      "description": "Files shipped by the item. Each path is relative to the item directory; target is the logical routing role the user's outlet.json maps to a project + namespace.",
      "minItems": 1,
      "items": {
        "type": "object",
        "additionalProperties": false,
        "required": ["path", "target"],
        "properties": {
          "path": {
            "type": "string",
            "description": "Source file path relative to the item directory, e.g. 'IEmailSender.cs'."
          },
          "target": {
            "type": "string",
            "description": "Logical routing role, e.g. 'contract' or 'adapter'.",
            "enum": ["contract", "adapter"]
          }
        }
      }
    }
  },
  "allOf": [
    {
      "if": {
        "properties": { "type": { "const": "outlet:contract" } }
      },
      "then": {
        "properties": {
          "nugetDependencies": {
            "maxItems": 0,
            "description": "A contract item must have zero external dependencies."
          }
        }
      }
    }
  ]
}
