{
  "$schema": "../../registry-item.schema.json",
  "name": "auth-pat-abstractions",
  "type": "outlet:contract",
  "concern": "auth",
  "description": "Generic personal access token authentication port (IPersonalAccessTokenAuthenticator) + lookup port and DTOs — zero external dependency.",
  "targetFrameworks": ["net8.0", "net9.0", "net10.0"],
  "registryDependencies": [],
  "nugetDependencies": [],
  "files": [
    { "path": "IPersonalAccessTokenAuthenticator.cs", "target": "contract" },
    { "path": "AuthenticatedToken.cs", "target": "contract" },
    { "path": "IPersonalAccessTokenStore.cs", "target": "contract" },
    { "path": "StoredAccessToken.cs", "target": "contract" }
  ]
}
